<?xml version="1.0" encoding="utf-8"?>
<xs:schema id="NewDataSet" xmlns="" xmlns:xs="http://www.w3.org/2001/XMLSchema" xmlns:msdata="urn:schemas-microsoft-com:xml-msdata">
<xs:include schemaLocation="../data../bonuses.xsd" />
  
  <xs:element name="chummer">
    <xs:complexType>
      <xs:sequence>
        <xs:element name="version" type="xs:string" minOccurs="0" />
        <xs:element name="categories" minOccurs="0" maxOccurs="unbounded">
          <xs:complexType>
            <xs:sequence>
              <xs:element name="category" nillable="true" minOccurs="0" maxOccurs="unbounded">
                <xs:complexType>
                  <xs:simpleContent msdata:ColumnName="category_Text" msdata:Ordinal="0">
                    <xs:extension base="xs:string">
                    </xs:extension>
                  </xs:simpleContent>
                </xs:complexType>
              </xs:element>
            </xs:sequence>
          </xs:complexType>
        </xs:element>
        <xs:element name="powers" minOccurs="0" maxOccurs="unbounded">
          <xs:complexType>
            <xs:sequence>
              <xs:element name="power" minOccurs="0" maxOccurs="unbounded">
                <xs:complexType>
                  <xs:sequence>
                    <xs:element name="id" type="xs:string" minOccurs="1" maxOccurs="1" />
                    <xs:element name="name" type="xs:string" minOccurs="1" maxOccurs="1" />
                    <xs:element name="category" type="xs:string" minOccurs="1" maxOccurs="1" />
					<xs:element name="toxic" type="xs:string" minOccurs="0" maxOccurs="1" />
                    <xs:element name="rating" type="xs:string" minOccurs="0" maxOccurs="1" />
                    <xs:element name="type" type="xs:string" minOccurs="1" maxOccurs="1" />
                    <xs:element name="action" type="xs:string" minOccurs="1" maxOccurs="1" />
                    <xs:element name="range" type="xs:string" minOccurs="1" maxOccurs="1" />
                    <xs:element name="duration" type="xs:string" minOccurs="1" maxOccurs="1" />
					<xs:element name="bonus" minOccurs="0" maxOccurs="1" />
                    <xs:element name="source" type="xs:string" minOccurs="1" maxOccurs="1" />
                    <xs:element name="page" type="xs:string" minOccurs="1" maxOccurs="1" />
                  </xs:sequence>
                </xs:complexType>
              </xs:element>
            </xs:sequence>
          </xs:complexType>
        </xs:element>
      </xs:sequence>
    </xs:complexType>
  </xs:element>
  <xs:element name="NewDataSet" msdata:IsDataSet="true" msdata:UseCurrentLocale="true">
    <xs:complexType>
      <xs:choice minOccurs="0" maxOccurs="unbounded">
        <xs:element ref="chummer" />
      </xs:choice>
    </xs:complexType>
  </xs:element>
</xs:schema>